<?xml version="1.0" encoding="UTF-8"?>
<!--
To change this license header, choose License Headers in Project Properties.
To change this template file, choose Tools | Templates
and open the template in the editor.
author : Chen Chun Hang
-->


<catalogs
    xmlns:xsi='http://www.w3.org/2001/XMLSchema-instance'
    xsi:noNamespaceSchemaLocation='FlowerCatalog.xsd'>
    <catalog>
        <code></code>
        <type></type>
        <description></description>
        <stock></stock>
        <price></price>
    </catalog>
    <catalog>
        <code></code>
        <type></type>
        <description></description>
        <stock></stock>
        <price></price>
    </catalog>
    <catalog>
        <code></code>
        <type></type>
        <description></description>
        <stock></stock>
        <price></price>
    </catalog>

</catalogs>
